{
  "schemaVersion": 1,
  "runId": "run-story-mainline-restructure-example",
  "workflowId": "wf-story-mainline-restructure",
  "workflowVersion": "1.0.0",
  "createdAt": "2026-08-01T15:51:23.762Z",
  "updatedAt": "2026-08-01T15:51:23.763Z",
  "status": "completed",
  "mode": "dry-run",
  "inputSummary": "演练：三世界主线重构基建，不执行正式迁移",
  "flags": {
    "dryRun": true
  },
  "activeNodeIds": [],
  "nodes": {
    "prepare-scope": {
      "status": "completed",
      "attempts": 1,
      "artifactPaths": [],
      "completionChecks": [
        {
          "id": "evidence-invocation:skill-liluo-executable-workflow",
          "ok": true,
          "detail": "已记录调用"
        },
        {
          "id": "evidence-status:skill-liluo-executable-workflow",
          "ok": true,
          "detail": "调用状态 succeeded"
        },
        {
          "id": "evidence-summary:skill-liluo-executable-workflow",
          "ok": true,
          "detail": "已有结果摘要"
        },
        {
          "id": "evidence-main-read:skill-liluo-executable-workflow",
          "ok": true,
          "detail": "主流程已读取结果"
        },
        {
          "id": "evidence-adoption:skill-liluo-executable-workflow",
          "ok": true,
          "detail": "采用决定：accepted"
        },
        {
          "id": "evidence-downstream:skill-liluo-executable-workflow",
          "ok": true,
          "detail": "已记录下游使用"
        }
      ],
      "startedAt": "2026-08-01T15:51:23.762Z",
      "endedAt": "2026-08-01T15:51:23.762Z"
    },
    "locate-sources": {
      "status": "completed",
      "attempts": 1,
      "artifactPaths": [],
      "completionChecks": [
        {
          "id": "evidence-invocation:skill-liluo-story-outline-graph-maintenance",
          "ok": true,
          "detail": "已记录调用"
        },
        {
          "id": "evidence-status:skill-liluo-story-outline-graph-maintenance",
          "ok": true,
          "detail": "调用状态 succeeded"
        },
        {
          "id": "evidence-summary:skill-liluo-story-outline-graph-maintenance",
          "ok": true,
          "detail": "已有结果摘要"
        },
        {
          "id": "evidence-main-read:skill-liluo-story-outline-graph-maintenance",
          "ok": true,
          "detail": "主流程已读取结果"
        },
        {
          "id": "evidence-adoption:skill-liluo-story-outline-graph-maintenance",
          "ok": true,
          "detail": "采用决定：accepted"
        },
        {
          "id": "evidence-downstream:skill-liluo-story-outline-graph-maintenance",
          "ok": true,
          "detail": "已记录下游使用"
        },
        {
          "id": "evidence-invocation:src/game/data/story_outline/mainline-restructure-preservation.json",
          "ok": true,
          "detail": "已记录调用"
        },
        {
          "id": "evidence-status:src/game/data/story_outline/mainline-restructure-preservation.json",
          "ok": true,
          "detail": "调用状态 succeeded"
        },
        {
          "id": "evidence-summary:src/game/data/story_outline/mainline-restructure-preservation.json",
          "ok": true,
          "detail": "已有结果摘要"
        },
        {
          "id": "evidence-artifacts:src/game/data/story_outline/mainline-restructure-preservation.json",
          "ok": true,
          "detail": "产物 1 项"
        },
        {
          "id": "evidence-main-read:src/game/data/story_outline/mainline-restructure-preservation.json",
          "ok": true,
          "detail": "主流程已读取结果"
        },
        {
          "id": "evidence-adoption:src/game/data/story_outline/mainline-restructure-preservation.json",
          "ok": true,
          "detail": "采用决定：accepted"
        }
      ],
      "startedAt": "2026-08-01T15:51:23.762Z",
      "endedAt": "2026-08-01T15:51:23.762Z"
    },
    "preserve-text": {
      "status": "completed",
      "attempts": 1,
      "artifactPaths": [],
      "completionChecks": [
        {
          "id": "evidence-invocation:scripts/tests/three-world-mainline-restructure-preservation.test.mjs",
          "ok": true,
          "detail": "已记录调用"
        },
        {
          "id": "evidence-status:scripts/tests/three-world-mainline-restructure-preservation.test.mjs",
          "ok": true,
          "detail": "调用状态 succeeded"
        },
        {
          "id": "evidence-summary:scripts/tests/three-world-mainline-restructure-preservation.test.mjs",
          "ok": true,
          "detail": "已有结果摘要"
        },
        {
          "id": "evidence-main-read:scripts/tests/three-world-mainline-restructure-preservation.test.mjs",
          "ok": true,
          "detail": "主流程已读取结果"
        },
        {
          "id": "evidence-adoption:scripts/tests/three-world-mainline-restructure-preservation.test.mjs",
          "ok": true,
          "detail": "采用决定：accepted"
        },
        {
          "id": "evidence-downstream:scripts/tests/three-world-mainline-restructure-preservation.test.mjs",
          "ok": true,
          "detail": "已记录下游使用"
        }
      ],
      "startedAt": "2026-08-01T15:51:23.762Z",
      "endedAt": "2026-08-01T15:51:23.762Z"
    },
    "independent-review": {
      "status": "completed",
      "attempts": 1,
      "artifactPaths": [],
      "completionChecks": [
        {
          "id": "evidence-invocation:agent-liluo-content-auditor",
          "ok": true,
          "detail": "已记录调用"
        },
        {
          "id": "evidence-status:agent-liluo-content-auditor",
          "ok": true,
          "detail": "调用状态 succeeded"
        },
        {
          "id": "evidence-summary:agent-liluo-content-auditor",
          "ok": true,
          "detail": "已有结果摘要"
        },
        {
          "id": "evidence-main-read:agent-liluo-content-auditor",
          "ok": true,
          "detail": "主流程已读取结果"
        },
        {
          "id": "evidence-adoption:agent-liluo-content-auditor",
          "ok": true,
          "detail": "采用决定：accepted"
        },
        {
          "id": "evidence-downstream:agent-liluo-content-auditor",
          "ok": true,
          "detail": "已记录下游使用"
        },
        {
          "id": "evidence-invocation:agent-liluo-continuity-reviewer",
          "ok": true,
          "detail": "已记录调用"
        },
        {
          "id": "evidence-status:agent-liluo-continuity-reviewer",
          "ok": true,
          "detail": "调用状态 succeeded"
        },
        {
          "id": "evidence-summary:agent-liluo-continuity-reviewer",
          "ok": true,
          "detail": "已有结果摘要"
        },
        {
          "id": "evidence-main-read:agent-liluo-continuity-reviewer",
          "ok": true,
          "detail": "主流程已读取结果"
        },
        {
          "id": "evidence-adoption:agent-liluo-continuity-reviewer",
          "ok": true,
          "detail": "采用决定：accepted"
        },
        {
          "id": "evidence-downstream:agent-liluo-continuity-reviewer",
          "ok": true,
          "detail": "已记录下游使用"
        }
      ],
      "adoption": "accepted",
      "endedAt": "2026-08-01T15:51:23.762Z"
    },
    "repair-review-gaps": {
      "status": "pending",
      "attempts": 0,
      "artifactPaths": [],
      "completionChecks": []
    },
    "approve-live-migrate": {
      "status": "pending",
      "attempts": 0,
      "artifactPaths": [],
      "completionChecks": []
    },
    "migrate-structure": {
      "status": "completed",
      "attempts": 1,
      "artifactPaths": [],
      "completionChecks": [
        {
          "id": "evidence-invocation:skill-liluo-executable-workflow",
          "ok": true,
          "detail": "已记录调用"
        },
        {
          "id": "evidence-status:skill-liluo-executable-workflow",
          "ok": true,
          "detail": "调用状态 succeeded"
        },
        {
          "id": "evidence-summary:skill-liluo-executable-workflow",
          "ok": true,
          "detail": "已有结果摘要"
        },
        {
          "id": "evidence-main-read:skill-liluo-executable-workflow",
          "ok": true,
          "detail": "主流程已读取结果"
        },
        {
          "id": "evidence-adoption:skill-liluo-executable-workflow",
          "ok": true,
          "detail": "采用决定：accepted"
        },
        {
          "id": "evidence-downstream:skill-liluo-executable-workflow",
          "ok": true,
          "detail": "已记录下游使用"
        }
      ],
      "startedAt": "2026-08-01T15:51:23.762Z",
      "endedAt": "2026-08-01T15:51:23.762Z"
    },
    "validate-structure": {
      "status": "completed",
      "attempts": 1,
      "artifactPaths": [],
      "completionChecks": [
        {
          "id": "evidence-invocation:scripts/tests/three-world-mainline-restructure-preservation.test.mjs",
          "ok": true,
          "detail": "已记录调用"
        },
        {
          "id": "evidence-status:scripts/tests/three-world-mainline-restructure-preservation.test.mjs",
          "ok": true,
          "detail": "调用状态 succeeded"
        },
        {
          "id": "evidence-summary:scripts/tests/three-world-mainline-restructure-preservation.test.mjs",
          "ok": true,
          "detail": "已有结果摘要"
        },
        {
          "id": "evidence-main-read:scripts/tests/three-world-mainline-restructure-preservation.test.mjs",
          "ok": true,
          "detail": "主流程已读取结果"
        },
        {
          "id": "evidence-adoption:scripts/tests/three-world-mainline-restructure-preservation.test.mjs",
          "ok": true,
          "detail": "采用决定：accepted"
        },
        {
          "id": "evidence-downstream:scripts/tests/three-world-mainline-restructure-preservation.test.mjs",
          "ok": true,
          "detail": "已记录下游使用"
        }
      ],
      "startedAt": "2026-08-01T15:51:23.763Z",
      "endedAt": "2026-08-01T15:51:23.763Z"
    },
    "sync-navigation": {
      "status": "completed",
      "attempts": 1,
      "artifactPaths": [],
      "completionChecks": [
        {
          "id": "evidence-invocation:skill-liluo-project-capability-navigation",
          "ok": true,
          "detail": "已记录调用"
        },
        {